<?xml version="1.0"?>
<xs:schema xmlns:xs="http://www.w3.org/2001/XMLSchema">

    <xs:element name="catalog">
        <xs:complexType>
            <xs:sequence>
                <xs:element ref="book" minOccurs="1" maxOccurs="unbounded"/>
            </xs:sequence>
        </xs:complexType>
    </xs:element>

    <xs:element name="book">
        <xs:complexType>
            <xs:sequence>
                <xs:element name="title"     type="xs:string"/>
                <xs:element name="author"    type="xs:string"/>
                <xs:element name="publisher" type="xs:string"/>
                <xs:element name="pages"     type="xs:integer"/>
                <xs:element name="price"     type="xs:decimal"/>
            </xs:sequence>
            <xs:attribute name="course" type="xs:string" use="required"/>
        </xs:complexType>
    </xs:element>

</xs:schema>
